Symbol,Name,Last Sale,Net Change,% Change,Market Cap,Country,IPO Year,Volume,Sector,Industry
PSIX,Power Solutions International Inc. Common Stock,$37.10,-1.08,-2.829%,853285754.00,United States,,203156,Industrials,Industrial Machinery/Components
PSMT,PriceSmart Inc. Common Stock,$88.23,0.20,0.227%,2705338699.00,United States,,224482,Consumer Discretionary,Department/Specialty Retail Stores
PSN,Parsons Corporation Common Stock,$65.08,-8.42,-11.456%,6910841881.00,United States,2019,5201431,Technology,EDP Services
PSNL,Personalis Inc. Common Stock,$5.825,-0.215,-3.56%,411525089.00,United States,2019,1005346,Health Care,Medical Specialities
PSNY,Polestar Automotive Holding UK PLC Class A ADS,$1.10,-0.02,-1.786%,2348731317.00,Sweden,,3027541,Consumer Discretionary,Auto Manufacturing
PSNYW,Polestar Automotive Holding UK PLC Class C-1 ADS (ADW),$0.2001,-0.0095,-4.532%,427255579.00,Sweden,,34757,Consumer Discretionary,Auto Manufacturing
PSO,Pearson Plc Common Stock,$17.15,0.11,0.646%,11426441852.00,United Kingdom,,374720,Consumer Discretionary,Books
PSQH,PSQ Holdings Inc. Class A Common Stock,$3.31,-0.10,-2.933%,115062955.00,,2021,1127649,Consumer Discretionary,Advertising
PSTG,Pure Storage Inc. Class A Common Stock,$67.89,-1.02,-1.48%,22148228029.00,United States,2015,1625863,Technology,Electronic Components
PSTL,Postal Realty Trust Inc. Class A Common Stock,$13.07,0.00,0.00%,306535467.00,United States,2019,202477,Real Estate,Real Estate Investment Trusts
PSTV,PLUS THERAPEUTICS Inc. Common Stock ,$1.20,0.02,1.695%,7075600.00,United States,,9629,Health Care,Medical/Dental Instruments
PSX,Phillips 66 Common Stock,$129.96,-0.32,-0.246%,53672079941.00,United States,,3631098,Energy,Integrated oil Companies
PT,Pintec Technology Holdings Limited American Depositary Shares,$1.11,0.0034,0.307%,17702237.00,China,2018,51470,Technology,Computer Software: Programming Data Processing
PTA,Cohen & Steers Tax-Advantaged Preferred Securities and Income Fund Common Shares of Beneficial Interest,$19.91,-0.01,-0.05%,1100494529.00,United States,2020,33830,Finance,Trusts Except Educational Religious and Charitable
PTC,PTC Inc. Common Stock,$169.92,-0.87,-0.509%,20445376257.00,United States,,975153,Technology,Computer Software: Prepackaged Software
PTCT,PTC Therapeutics Inc. Common Stock,$50.425,0.985,1.992%,3889035336.00,United States,2013,639035,Health Care,Biotechnology: Pharmaceutical Preparations
PTEN,Patterson-UTI Energy Inc. Common Stock,$8.86,-0.23,-2.53%,3423418031.00,United States,1993,6019097,Energy,Oil & Gas Production
PTGX,Protagonist Therapeutics Inc. Common Stock,$38.53,0.78,2.066%,2296311634.00,United States,2016,456605,Health Care,Biotechnology: Pharmaceutical Preparations
PTHL,Pheton Holdings Ltd Class A Ordinary Shares,$3.10,0.44,16.541%,44950000.00,China,2024,30855,Health Care,Biotechnology: Electromedical & Electrotherapeutic Apparatus
PTIX,Protagenic Therapeutics Inc. Common Stock,$0.253,-0.014,-5.243%,1719090.00,United States,,133167,Health Care,Biotechnology: Pharmaceutical Preparations
PTLE,PTL LTD Ordinary Shares,$1.365,0.065,5.00%,17062500.00,Singapore,2024,71910,Energy,Oil Refining/Marketing
PTLO,Portillo's Inc. Class A Common Stock,$14.60,-0.54,-3.567%,1083644295.00,United States,2021,2473139,Consumer Discretionary,Restaurants
PTMN,Portman Ridge Finance Corporation Common Stock,$17.40,0.07,0.404%,160305835.00,United States,2006,38832,Finance,Finance: Consumer Services
PTN,Palatin Technologies Inc. Common Stock,$1.01,-0.02,-1.942%,26265904.00,United States,1999,581105,Health Care,Biotechnology: Pharmaceutical Preparations
PTON,Peloton Interactive Inc. Class A Common Stock,$9.79,0.16,1.661%,3817752416.00,United States,2019,12453513,Consumer Discretionary,Recreational Games/Products/Toys
PTPI,Petros Pharmaceuticals Inc. Common Stock,$0.1577,0.0214,15.701%,1579345.00,United States,,14541111,Health Care,Biotechnology: Pharmaceutical Preparations
PTVE,Pactiv Evergreen Inc. Common stock,$17.83,0.01,0.056%,3196763522.00,United States,2020,329961,Consumer Discretionary,Containers/Packaging
PTY,Pimco Corporate & Income Opportunity Fund,$14.74,0.03,0.204%,0.00,United States,2002,503509,Finance,Investment Managers
PUBM,PubMatic Inc. Class A Common Stock,$15.13,-0.52,-3.323%,722710837.00,United States,2020,274978,Technology,Computer Software: Programming Data Processing
PUK,Prudential Public Limited Company Common Stock,$17.92,-0.48,-2.609%,23696991611.00,United Kingdom,,818926,Finance,Life Insurance
PULM,Pulmatrix Inc. Common Stock,$9.39,-0.63,-6.287%,34294956.00,United States,2014,58188,Health Care,Biotechnology: Pharmaceutical Preparations
PUMP,ProPetro Holding Corp. Common Stock,$8.82,-0.21,-2.326%,907840360.00,United States,2017,2847822,Energy,Oilfield Services/Equipment
PVBC,Provident Bancorp Inc. (MD) Common Stock,$12.58,-0.16,-1.256%,223043941.00,United States,2015,17261,Finance,Banks
PVH,PVH Corp. Common Stock,$79.21,-0.59,-0.739%,4406705614.00,United States,,801153,Consumer Discretionary,Apparel
PVL,Permianville Royalty Trust Trust Units ,$1.45,0.0111,0.771%,47850000.00,United States,2011,53171,Energy,Oil & Gas Production
PVLA,Palvella Therapeutics Inc. Common Stock,$20.97,-0.02,-0.095%,27685433.00,United States,,21783,Health Care,Biotechnology: Pharmaceutical Preparations
PW,Power REIT (MD) Common Stock,$1.145,-0.025,-2.137%,3881162.00,United States,1998,53863,Real Estate,Real Estate Investment Trusts
PW^A,Power REIT 7.75% Series A Cumulative Perpetual Preferred Stock,$7.50,0.30,4.167%,,United States,,18627,,
PWM,Prestige Wealth Inc. Class A Ordinary Shares,$0.60,-0.27,-31.034%,18985175.00,Hong Kong,2023,2209924,Finance,Finance: Consumer Services
PWOD,Penns Woods Bancorp Inc. Common Stock,$30.93,-0.08,-0.258%,233352344.00,United States,,6996,Finance,Major Banks
PWP,Perella Weinberg Partners Class A Common Stock,$24.32,0.38,1.587%,2144135761.00,United States,2020,393488,Finance,Finance: Consumer Services
PWR,Quanta Services Inc. Common Stock,$292.07,4.48,1.558%,43112918552.00,United States,,1728571,Industrials,Engineering & Construction
PWUPW,PowerUp Acquisition Corp. Warrant,$0.0655,0.00,0.00%,0.00,United States,2022,1004,Finance,Blank Checks
PX,P10 Inc. Class A Common Stock,$13.19,-0.21,-1.567%,1472304138.00,United States,2021,739880,Finance,Investment Managers
PXLW,Pixelworks Inc.  Common Stock,$0.8556,0.0226,2.713%,50427702.00,United States,2000,657605,Technology,Semiconductors
PXS,Pyxis Tankers Inc. Common Stock,$3.68,-0.01,-0.271%,38796573.00,Greece,,13069,Consumer Discretionary,Marine Transportation
PXSAW,Pyxis Tankers Inc. Warrant,$0.15,-0.0299,-16.62%,1581382.00,Greece,,13892,Consumer Discretionary,Marine Transportation
PYCR,Paycor HCM Inc. Common Stock,$22.24,0.01,0.045%,4042608124.00,United States,2021,1591993,Technology,Computer Software: Prepackaged Software
PYN,PIMCO New York Municipal Income Fund III Common Shares of Beneficial Interest,$5.845,0.035,0.602%,0.00,United States,2002,11194,Finance,Investment Managers
PYPD,PolyPid Ltd. Ordinary Shares,$2.90,0.03,1.045%,19730086.00,Israel,2020,13802,Health Care,Biotechnology: Pharmaceutical Preparations
PYPL,PayPal Holdings Inc. Common Stock,$78.36,-0.26,-0.331%,77517038539.00,United States,,9061828,Consumer Discretionary,Business Services
PYT,PPlus Tr GSC-2 Tr Ctf Fltg Rate,$22.9001,0.0001,0.00%,0.00,United States,,601,Finance,Finance: Consumer Services
PYXS,Pyxis Oncology Inc. Common Stock,$1.35,0.00,0.00%,80278734.00,United States,2021,429701,Health Care,Biotechnology: Pharmaceutical Preparations
PZC,PIMCO California Municipal Income Fund III Common Shares of Beneficial Interest,$6.81,0.05,0.74%,0.00,United States,2002,78475,Finance,Investment Managers
PZG,Paramount Gold Nevada Corp. Common Stock,$0.3685,-0.0166,-4.311%,24911591.00,United States,2015,158503,Basic Materials,Metal Mining
PZZA,Papa John's International Inc. Common Stock,$49.05,-2.03,-3.974%,1601071608.00,United States,1993,1624305,Consumer Discretionary,Restaurants
QBTS,D-Wave Quantum Inc. Common Shares,$6.54,0.50,8.278%,1465056982.00,,2022,97418854,Technology,EDP Services
QCOM,QUALCOMM Incorporated Common Stock,$175.22,1.58,0.91%,193793320000.00,United States,1991,6847283,Technology,Radio And Television Broadcasting And Communications Equipment
QCRH,QCR Holdings Inc. Common Stock,$77.04,-0.15,-0.194%,1299582444.00,United States,,58440,Finance,Major Banks
QD,Qudian Inc. American Depositary Shares each representing one Class A Ordinary Share,$3.04,-0.10,-3.185%,575787707.00,China,2017,486985,Finance,Finance: Consumer Services
QDEL,QuidelOrtho Corporation Common Stock,$41.89,0.40,0.964%,2817383875.00,United States,,844051,Health Care,Biotechnology: In Vitro & In Vivo Diagnostic Substances
QETA,Quetta Acquisition Corporation Common Stock,$10.70,0.00,0.00%,0.00,United States,2023,61,Finance,Blank Checks
QETAR,Quetta Acquisition Corporation Right,$1.6088,-0.1412,-8.069%,0.00,United States,2023,7634,Finance,Blank Checks
QFIN,Qifu Technology Inc. American Depositary Shares,$44.04,-1.25,-2.76%,6837407079.00,China,2018,1504519,Finance,Finance: Consumer Services
QGEN,Qiagen N.V. Common Shares,$39.22,-0.79,-1.975%,8440454779.00,Netherlands,,1304511,Health Care,Biotechnology: Biological Products (No Diagnostic Substances)
QH,Quhuo Limited American Depository Shares,$1.38,0.02,1.471%,8511317.00,China,2020,3391,Consumer Discretionary,Business Services
QIPT,Quipt Home Medical Corp. Common Shares,$2.66,-0.04,-1.481%,114622786.00,United States,,110009,Health Care,Misc Health and Biotechnology Services
QLGN,Qualigen Therapeutics Inc. Common Stock,$3.53,-0.07,-1.944%,2599601.00,United States,2015,4889,Health Care,Biotechnology: Pharmaceutical Preparations
QLYS,Qualys Inc. Common Stock,$145.96,-1.74,-1.178%,5340742374.00,United States,2012,353375,Technology,Computer Software: Prepackaged Software
QMCO,Quantum Corporation Common Stock,$15.83,0.52,3.396%,92355370.00,United States,,1958993,Technology,Electronic Components
QMMM,QMMM Holdings Limited Ordinary Shares,$0.844,0.074,9.61%,14522153.00,Hong Kong,2024,247108,Consumer Discretionary,Advertising
QNCX,Quince Therapeutics Inc. Common Stock,$1.43,0.02,1.418%,62922349.00,United States,2019,188831,Health Care,Biotechnology: Biological Products (No Diagnostic Substances)
QNRX,Quoin Pharmaceuticals Ltd. American Depositary Shares,$0.3275,0.0175,5.645%,1653783.00,Israel,2016,797101,Health Care,Medical/Dental Instruments
QNST,QuinStreet Inc. Common Stock,$22.60,-0.31,-1.353%,1276190360.00,United States,2010,701524,Consumer Discretionary,Business Services
QNTM,Quantum Biopharma Ltd. Class B Subordinate Voting Shares,$7.41,-1.14,-13.333%,9636557.00,Canada,,343582,Health Care,Biotechnology: Pharmaceutical Preparations
QQQX,Nuveen NASDAQ 100 Dynamic Overwrite Fund Shares of Beneficial Interest,$27.34,0.00,0.00%,0.00,United States,,103518,Finance,Finance Companies
QRHC,Quest Resource Holding Corporation Common Stock,$4.75,0.17,3.712%,97791456.00,United States,,93599,Utilities,Environmental Services
QRTEA,Qurate Retail Inc. Series A Common Stock,$0.3602,-0.0046,-1.261%,142981399.00,United States,,943415,Consumer Discretionary,Catalog/Specialty Distribution
QRTEB,Qurate Retail Inc. Series B Common Stock,$2.11,-0.07,-3.211%,837564551.00,United States,,730,Consumer Discretionary,Catalog/Specialty Distribution
QRTEP,Qurate Retail Inc. 8.0% Fixed Rate Cumulative Redeemable Preferred Stock,$39.07,0.07,0.179%,15508837438.00,United States,,37019,Consumer Discretionary,Catalog/Specialty Distribution
QRVO,Qorvo Inc. Common Stock,$78.89,0.93,1.193%,7368076076.00,United States,,2190755,Technology,Semiconductors
QS,QuantumScape Corporation Class A Common Stock,$5.20,-0.34,-6.137%,2664850365.00,United States,2020,14000747,Miscellaneous,Industrial Machinery/Components
QSG,QuantaSing Group Limited American Depositary Shares,$2.60,0.04,1.563%,132893808.00,China,2023,42751,Real Estate,Other Consumer Services
QSI,Quantum-Si Incorporated Class A Common Stock,$1.91,-0.01,-0.521%,272581547.00,United States,2020,11302761,Industrials,Industrial Machinery/Components
QSIAW,Quantum-Si Incorporated Warrant,$0.61,0.02,3.39%,87054840.00,United States,2020,47496,Industrials,Industrial Machinery/Components
QSR,Restaurant Brands International Inc. Common Shares,$63.19,-1.46,-2.258%,20455076925.00,Canada,2014,2103629,Consumer Discretionary,Restaurants
QTRX,Quanterix Corporation Common Stock,$7.81,0.06,0.774%,300874986.00,United States,2017,789335,Industrials,Biotechnology: Laboratory Analytical Instruments
QTTB,Q32 Bio Inc. Common Stock,$2.42,-0.19,-7.28%,29477296.00,United States,2018,484241,Health Care,Biotechnology: Pharmaceutical Preparations
QTWO,Q2 Holdings Inc. Common Stock,$92.00,-1.65,-1.762%,5586974712.00,United States,2014,646695,Technology,Computer Software: Prepackaged Software
QUAD,Quad Graphics Inc Class A Common Stock,$7.78,0.76,10.826%,405485096.00,United States,,1069679,Consumer Discretionary,Publishing
QUBT,Quantum Computing Inc. Common Stock,$7.96,0.58,7.859%,788728349.00,United States,,24675014,Technology,Computer Software: Prepackaged Software
QUIK,QuickLogic Corporation Common Stock,$8.38,0.41,5.144%,123245263.00,United States,1999,242298,Technology,Semiconductors
QURE,uniQure N.V. Ordinary Shares,$13.41,0.16,1.208%,653645507.00,Netherlands,2014,767536,Health Care,Biotechnology: Pharmaceutical Preparations
QVCC,QVC Inc. 6.250% Senior Secured Notes due 2068,$12.324,-0.006,-0.049%,12.00,United States,2019,14296,Consumer Discretionary,Catalog/Specialty Distribution
QVCD,QVC Inc. 6.375% Senior Secured Notes due 2067,$12.38,-0.01,-0.081%,12.00,United States,2018,8571,Consumer Discretionary,Catalog/Specialty Distribution
QXO,QXO Inc. Common Stock,$13.04,-0.31,-2.322%,5338969743.00,United States,,1516549,Technology,EDP Services
R,Ryder System Inc. Common Stock,$167.85,-3.07,-1.796%,7063955165.00,United States,,489441,Consumer Discretionary,Rental/Leasing Companies
RA,Brookfield Real Assets Income Fund Inc. Common Stock,$13.44,0.05,0.373%,0.00,United States,2016,113710,Finance,Investment Managers
RACE,Ferrari N.V. Common Shares,$500.84,-3.85,-0.763%,122080231808.00,Italy,2015,171285,Consumer Discretionary,Auto Manufacturing
RADX,Radiopharm Theranostics Limited American Depositary Shares,$4.73,0.23,5.111%,0.00,Australia,,980,,
RAIL,FreightCar America Inc. Common Stock,$9.85,-0.53,-5.106%,186105624.00,United States,2005,217632,Industrials,Railroads
RAIN,Rain Enhancement Technologies Holdco Inc. Class A Common Stock,$2.6271,-0.2029,-7.17%,17408113.00,United States,,3464,Technology,Industrial Machinery/Components
RAINW,Rain Enhancement Technologies Holdco Inc. Warrants,$0.1062,-0.0188,-15.04%,703720.00,United States,,30864,Technology,Industrial Machinery/Components
RAMP,LiveRamp Holdings Inc. Common Stock,$33.15,-0.74,-2.184%,2179966874.00,United States,2018,487693,Technology,EDP Services
RAND,Rand Capital Corporation Common Stock,$27.9063,0.6063,2.221%,72026746.00,United States,,9318,Finance,Finance: Consumer Services
RANG,Range Capital Acquisition Corp. Ordinary Shares,$9.99,0.00,0.00%,0.00,United States,2025,56,,
RANGR,Range Capital Acquisition Corp. Rights,$0.21,-0.0174,-7.652%,0.00,United States,2025,100,,
RANGU,Range Capital Acquisition Corp. Units,$10.20,-0.12,-1.163%,0.00,United States,2024,4476,,
RANI,Rani Therapeutics Holdings Inc. Class A Common Stock,$1.73,-0.02,-1.143%,99109420.00,United States,2021,331223,Health Care,Biotechnology: Pharmaceutical Preparations
RAPP,Rapport Therapeutics Inc. Common Stock,$13.67,-0.37,-2.635%,500000167.00,United States,2024,88607,Health Care,Biotechnology: Pharmaceutical Preparations
RAPT,RAPT Therapeutics Inc. Common Stock,$1.20,0.00,0.00%,41949904.00,United States,2019,411161,Health Care,Biotechnology: Pharmaceutical Preparations
RARE,Ultragenyx Pharmaceutical Inc. Common Stock,$44.29,0.67,1.536%,4089927630.00,United States,2014,684999,Health Care,Biotechnology: Pharmaceutical Preparations
RAVE,Rave Restaurant Group Inc. Common Stock,$2.61,0.08,3.162%,38397187.00,United States,,50888,Consumer Discretionary,Food Distributors
RAY,Raytech Holding Limited Ordinary Shares,$1.23,-0.03,-2.381%,21664092.00,Hong Kong,2024,10034,Consumer Discretionary,Consumer Electronics/Appliances
RAYA,Erayak Power Solution Group Inc. Class A Ordinary Shares,$1.28,-0.01,-0.775%,15936000.00,China,2022,2406,Consumer Discretionary,Metal Fabrications
RBA,RB Global Inc. Common Stock,$104.72,8.16,8.451%,19295079404.00,Canada,,3706372,Consumer Discretionary,Business Services
RBB,RBB Bancorp Common Stock,$17.65,-0.03,-0.17%,312288792.00,United States,2017,16741,Finance,Major Banks
RBBN,Ribbon Communications Inc. Common Stock,$5.06,-0.08,-1.556%,887441456.00,United States,,811174,Technology,EDP Services
RBC,RBC Bearings Incorporated Common Stock,$370.84,1.23,0.333%,11660783816.00,United States,2022,96264,Industrials,Metal Fabrications
RBCAA,Republic Bancorp Inc. Class A Common Stock,$67.65,0.20,0.297%,1315510941.00,United States,1998,13985,Finance,Major Banks
RBKB,Rhinebeck Bancorp Inc. Common Stock,$10.13,0.06,0.596%,112317459.00,United States,2019,370,Finance,Banks
RBLX,Roblox Corporation Class A Common Stock,$63.64,-2.46,-3.722%,41762112670.00,United States,2021,5528130,Technology,Computer Software: Prepackaged Software
RBOT,Vicarious Surgical Inc. Class A Common Stock,$15.66,-0.04,-0.255%,92522710.00,Hong Kong,2020,91874,Health Care,Industrial Specialties
RBRK,Rubrik Inc. Class A Common Stock,$74.19,-3.90,-4.994%,13743232477.00,United States,2024,1974530,Technology,Computer Software: Prepackaged Software
RC,Ready Capital Corporation Common Stock,$6.85,0.00,0.00%,1154435322.00,United States,2013,2723308,Real Estate,Real Estate Investment Trusts
RC^C,Ready Capital Corporation 6.25% Series C Cumulative Convertible Preferred Stock,$17.90,0.00,0.00%,,United States,,20,,
RC^E,Ready Capital Corporation 6.50% Series E Cumulative Redeemable Preferred Stock,$18.04,0.0115,0.064%,,United States,,5987,,
RCAT,Red Cat Holdings Inc. Common Stock,$8.74,-0.17,-1.908%,700605235.00,United States,,7455912,Technology,Computer Software: Prepackaged Software
RCB,Ready Capital Corporation 6.20% Senior Notes due 2026,$24.0949,-0.0251,-0.104%,4060730460.00,United States,2019,41418,Real Estate,Real Estate Investment Trusts
RCC,Ready Capital Corporation 5.75% Senior Notes due 2026,$24.57,0.00,0.00%,4140799397.00,United States,2021,106,Real Estate,Real Estate Investment Trusts
RCD,Ready Capital Corporation 9.00% Senior Notes due 2029,$25.18,-0.11,-0.435%,0.00,United States,2024,19224,Real Estate,Real Estate Investment Trusts
RCEL,Avita Medical Inc. Common Stock,$10.22,-0.12,-1.161%,269374079.00,United States,,154061,Health Care,Medical/Dental Instruments
RCG,RENN Fund Inc Common Stock,$2.7643,0.0143,0.52%,0.00,United States,,4108,Finance,Investment Managers
RCI,Rogers Communication Inc. Common Stock,$28.08,0.26,0.935%,15007851472.00,Canada,,706708,Telecommunications,Cable & Other Pay Television Services
RCKT,Rocket Pharmaceuticals Inc. Common Stock,$10.92,0.12,1.111%,995435368.00,United States,2015,924354,Health Care,Biotechnology: Pharmaceutical Preparations
RCKTW,Rocket Pharmaceuticals Inc. Warrant,$0.0759,0.0044,6.154%,6918823.00,United States,,12548,Health Care,Biotechnology: Pharmaceutical Preparations
RCKY,Rocky Brands Inc. Common Stock,$23.61,-0.44,-1.83%,175984549.00,United States,1993,35618,Consumer Discretionary,Shoe Manufacturing
RCL,Royal Caribbean Cruises Ltd. Common Stock,$264.01,2.21,0.844%,71052682344.00,United States,1993,1649014,Consumer Discretionary,Marine Transportation
RCMT,RCM Technologies Inc. Common Stock,$19.82,-0.09,-0.452%,150573095.00,United States,,32736,Consumer Discretionary,Professional Services
RCON,Recon Technology Ltd. Class A Ordinary Shares,$2.1492,0.0694,3.337%,32427041.00,China,2009,621,Energy,Oilfield Services/Equipment
RCS,PIMCO Strategic Income Fund Inc.,$6.39,-0.02,-0.312%,0.00,United States,1994,162793,Finance,Investment Managers
RCUS,Arcus Biosciences Inc. Common Stock,$11.10,0.14,1.277%,1015778860.00,United States,2018,4737451,Health Care,Biotechnology: Pharmaceutical Preparations
RDAC,Rising Dragon Acquisition Corp. Ordinary Shares,$10.06,0.00,0.00%,0.00,China,2024,16,,
RDCM,Radcom Ltd. Ordinary Shares,$13.16,0.29,2.253%,201449753.00,Israel,1997,117073,Technology,Computer peripheral equipment
RDDT,Reddit Inc. Class A Common Stock,$189.66,2.53,1.352%,34310318831.00,United States,2024,4432531,Technology,EDP Services
RDFN,Redfin Corporation Common Stock,$8.99,0.15,1.697%,1114584461.00,United States,2017,8191763,Finance,Real Estate
RDHL,Redhill Biopharma Ltd. American Depositary Shares,$5.02,-0.266,-5.032%,6428306.00,Israel,,13360,Health Care,Biotechnology: Pharmaceutical Preparations
RDI,Reading International Inc Class A Common Stock,$1.513,-0.047,-3.013%,33930816.00,United States,,10752,Consumer Discretionary,Movies/Entertainment
RDIB,Reading International Inc Class B Common Stock,$7.39,0.00,0.00%,165729500.00,United States,,173,Consumer Discretionary,Movies/Entertainment
RDN,Radian Group Inc. Common Stock,$32.81,0.06,0.183%,4759521787.00,United States,,2060955,Finance,Property-Casualty Insurers
RDNT,RadNet Inc. Common Stock,$64.31,2.85,4.637%,4760659456.00,United States,,790236,Health Care,Medical Specialities
RDUS,Radius Recycling Inc. Class A Common Stock,$12.88,-0.64,-4.734%,362641346.00,United States,,237864,Consumer Discretionary,Industrial Specialties
RDVT,Red Violet Inc. Common Stock ,$41.06,1.29,3.244%,566285231.00,United States,,85763,Technology,Computer Software: Prepackaged Software
RDW,Redwire Corporation Common Stock,$21.72,-1.86,-7.888%,1445267718.00,United States,2021,1825939,Industrials,Military/Government/Technical
RDWR,Radware Ltd. Ordinary Shares,$23.52,-0.29,-1.218%,980757564.00,Israel,1999,102604,Consumer Discretionary,Business Services
RDY,Dr. Reddy's Laboratories Ltd Common Stock,$13.37,-0.19,-1.401%,11155737210.00,India,,3037683,Health Care,Biotechnology: Pharmaceutical Preparations
RDZN,Roadzen Inc. Ordinary Shares,$1.17,0.01,0.862%,86803454.00,United States,2022,145845,Finance,Specialty Insurers
RDZNW,Roadzen Inc. Warrants,$0.085,0.0058,7.323%,6306234.00,United States,2022,21055,Finance,Specialty Insurers
REAL,The RealReal Inc. Common Stock,$7.97,-0.22,-2.686%,874238832.00,United States,2019,3282775,Consumer Discretionary,Other Specialty Stores
REAX,The Real Brokerage Inc. Common Shares,$5.48,0.31,5.996%,1083604240.00,Canada,,892520,Finance,Real Estate
REBN,Reborn Coffee Inc. Common Stock,$5.59,0.36,6.883%,20529633.00,United States,2022,1677417,Consumer Discretionary,Restaurants
RECT,Rectitude Holdings Ltd Ordinary Shares,$3.80,-0.23,-5.707%,55100000.00,Singapore,2024,7048,Consumer Discretionary,Industrial Machinery/Components
REE,REE Automotive Ltd. Class A Ordinary Shares,$8.11,-0.16,-1.935%,91098251.00,Israel,,21954,Consumer Discretionary,Auto Manufacturing
REFI,Chicago Atlantic Real Estate Finance Inc. Common Stock,$16.03,0.00,0.00%,314740746.00,United States,2021,76979,Real Estate,Real Estate Investment Trusts
REFR,Research Frontiers Incorporated Common Stock,$1.395,0.015,1.087%,46757313.00,United States,,13778,Miscellaneous,Multi-Sector Companies
REG,Regency Centers Corporation Common Stock,$73.44,0.57,0.782%,13319463005.00,United States,1993,1110401,Real Estate,Real Estate Investment Trusts
REGCO,Regency Centers Corporation 5.875% Series B Cumulative Redeemable Preferred Stock,$22.27,-0.09,-0.403%,4039003828.00,United States,,6560,Real Estate,Real Estate Investment Trusts
REGCP,Regency Centers Corporation 6.25% Series A Cumulative Redeemable Preferred Stock,$23.40,-0.195,-0.826%,4243946546.00,United States,,3371,Real Estate,Real Estate Investment Trusts
REGN,Regeneron Pharmaceuticals Inc. Common Stock,$685.66,5.66,0.832%,74959561460.00,United States,1991,638293,Health Care,Biotechnology: Pharmaceutical Preparations
REI,Ring Energy Inc. Common Stock,$1.38,0.02,1.471%,273510527.00,United States,,1122390,Energy,Oil & Gas Production
REKR,Rekor Systems Inc. Common Stock,$2.02,-0.16,-7.339%,189527154.00,United States,,5030227,Telecommunications,Telecommunications Equipment
RELI,Reliance Global Group Inc. Common Stock,$1.525,-0.065,-4.088%,2611674.00,United States,,38128,Finance,Specialty Insurers
RELIW,Reliance Global Group Inc. Series A Warrants,$0.03,0.00,0.00%,51377.00,United States,,42,Finance,Specialty Insurers
RELL,Richardson Electronics Ltd. Common Stock,$13.50,-0.05,-0.369%,194516208.00,United States,1983,21535,Technology,Electronic Components
RELX,RELX PLC PLC American Depositary Shares (Each representing One Ordinary Share),$50.52,-0.37,-0.727%,93892546444.00,United Kingdom,2015,780723,Consumer Discretionary,Business Services
RELY,Remitly Global Inc. Common Stock,$25.91,-0.56,-2.116%,5131764682.00,United States,2021,3427873,Consumer Discretionary,Business Services
RENB,Renovaro Inc. Common Stock,$0.86,0.0459,5.638%,136496914.00,United States,,674664,Health Care,Biotechnology: Pharmaceutical Preparations
RENE,Cartesian Growth Corporation II Class A Ordinary Shares,$11.72,-0.08,-0.678%,0.00,United States,2022,674,Finance,Blank Checks
RENEU,Cartesian Growth Corporation II Unit,$11.69,-0.05,-0.426%,0.00,United States,2022,100,Finance,Blank Checks
RENEW,Cartesian Growth Corporation II Warrant,$0.08,0.014,21.212%,0.00,United States,2022,212300,Finance,Blank Checks
RENT,Rent the Runway Inc. Class A Common Stock,$6.85,-0.31,-4.33%,26593173.00,United States,2021,52353,Consumer Discretionary,Other Specialty Stores
REPL,Replimune Group Inc. Common Stock,$13.78,-0.25,-1.782%,1061263682.00,United States,2018,373003,Health Care,Biotechnology: Biological Products (No Diagnostic Substances)
REPX,Riley Exploration Permian Inc. Common Stock,$35.42,0.19,0.539%,760923114.00,United States,1999,82239,Energy,Oil & Gas Production
RERE,ATRenew Inc. American Depositary Shares (every three of which representing two Class A ordinary shares),$2.92,0.00,0.00%,647364000.00,Cayman Islands,2021,405637,Consumer Discretionary,Other Specialty Stores
