Symbol,Name,Last Sale,Net Change,% Change,Market Cap,Country,IPO Year,Volume,Sector,Industry
DHIL,Diamond Hill Investment Group Inc. Class A Common Stock,$147.66,-1.36,-0.913%,401997853.00,United States,,15478,Finance,Investment Managers
DHR,Danaher Corporation Common Stock,$204.98,0.45,0.22%,148051958402.00,United States,,4572702,Industrials,Industrial Machinery/Components
DHT,DHT Holdings Inc.,$11.08,0.05,0.453%,1783874925.00,Jersey,2005,1515277,Consumer Discretionary,Marine Transportation
DHX,DHI Group Inc. Common Stock,$3.04,0.12,4.11%,148723704.00,United States,2007,292865,Consumer Discretionary,Business Services
DHY,Credit Suisse High Yield Bond Fund Common Stock,$2.15,-0.01,-0.463%,0.00,United States,1998,330825,Finance,Finance/Investors Services
DIAX,Nuveen Dow 30SM Dynamic Overwrite Fund Common Shares of Beneficial Interest,$15.51,-0.02,-0.129%,0.00,,2014,49461,Finance,Finance Companies
DIBS,1stdibs.com Inc. Common Stock,$4.02,-0.07,-1.711%,146782421.00,United States,2021,36232,Consumer Discretionary,Catalog/Specialty Distribution
DIN,Dine Brands Global Inc. Common Stock,$27.22,-0.31,-1.126%,415008995.00,United States,,489150,Consumer Discretionary,Restaurants
DINO,HF Sinclair Corporation Common Stock,$37.86,-0.62,-1.611%,7123429533.00,United States,1960,2685564,Energy,Natural Gas Distribution
DIOD,Diodes Incorporated Common Stock,$57.11,1.96,3.554%,2646130742.00,United States,,411754,Technology,Semiconductors
DIS,Walt Disney Company (The) Common Stock,$111.35,1.79,1.634%,201297290118.00,United States,,8447734,Consumer Discretionary,Services-Misc. Amusement & Recreation
DIST,Distoken Acquisition Corporation Ordinary Shares,$11.1101,0.00,0.00%,0.00,China,2023,2,Finance,Blank Checks
DISTR,Distoken Acquisition Corporation Right,$0.09,0.00,0.00%,0.00,China,2023,8963,Finance,Blank Checks
DISTW,Distoken Acquisition Corporation Warrant,$0.0232,0.0032,16.00%,0.00,China,2023,100,Finance,Blank Checks
DIT,AMCON Distributing Company Common Stock,$131.499,2.509,1.945%,84877608.00,United States,1999,313,Consumer Discretionary,Food Distributors
DJCO,Daily Journal Corp. (S.C.) Common Stock,$430.80,-12.80,-2.885%,593222801.00,United States,,31170,Consumer Discretionary,Newspapers/Magazines
DJT,Trump Media & Technology Group Corp. Common Stock,$28.25,-0.98,-3.353%,6216846561.00,United States,2024,4341738,Technology,Computer Software: Programming Data Processing
DJTWW,Trump Media & Technology Group Corp. Warrants,$18.64,-0.67,-3.47%,4102018404.00,United States,2021,90929,Technology,Computer Software: Programming Data Processing
DK,Delek US Holdings Inc. Common Stock,$17.70,-0.20,-1.117%,1118554421.00,United States,2017,1030116,Energy,Integrated oil Companies
DKL,Delek Logistics Partners L.P. Common Units representing Limited Partner Interests,$40.83,-0.21,-0.512%,2101383891.00,United States,2012,236228,Energy,Natural Gas Distribution
DKNG,DraftKings Inc. Class A Common Stock,$50.78,-0.71,-1.379%,24879976902.00,United States,2019,14687779,Consumer Discretionary,Services-Misc. Amusement & Recreation
DKS,Dick's Sporting Goods Inc Common Stock,$230.96,-3.68,-1.568%,18817375695.00,United States,2002,684579,Consumer Discretionary,Other Specialty Stores
DLB,Dolby Laboratories Common Stock,$83.37,-1.13,-1.337%,8034956909.00,United States,2005,600477,Miscellaneous,Multi-Sector Companies
DLHC,DLH Holdings Corp.,$5.66,-0.07,-1.222%,81427409.00,United States,,50448,Consumer Discretionary,Professional Services
DLNG,Dynagas LNG Partners LP Common Units,$4.22,-0.09,-2.088%,155455402.00,Greece,,37060,Consumer Discretionary,Marine Transportation
DLNG^A,Dynagas LNG Partners LP 9.00% Series A Cumulative Redeemable Preferred Units,$25.0201,0.0101,0.04%,,Greece,,10172,,
DLNG^B,Dynagas LNG Partners LP 8.75% Series B Fixed to Floating Rate Cumulative Redeemable Perpetual Preferred Units liquidation preference $25.00 per Uni,$25.425,0.032,0.126%,,Greece,,3218,,
DLO,DLocal Limited Class A Common Shares,$13.41,-0.29,-2.117%,3969248228.00,Uruguay,2021,1079502,Consumer Discretionary,Business Services
DLPN,Dolphin Entertainment Inc. Common Stock,$1.15,0.04,3.604%,12836330.00,United States,,27815,Consumer Discretionary,Other Consumer Services
DLR,Digital Realty Trust Inc. Common Stock,$169.61,3.96,2.391%,56261775104.00,United States,2004,2119175,Real Estate,Real Estate Investment Trusts
DLR^J,Digital Realty Trust Inc. 5.250% Series J Cumulative Redeemable Preferred Stock,$21.65,-0.15,-0.688%,,United States,,11624,,
DLR^K,Digital Realty Trust Inc. 5.850% Series K Cumulative Redeemable Preferred Stock par value $0.01 per share,$24.10,-0.05,-0.207%,,United States,,30286,,
DLR^L,Digital Realty Trust Inc. 5.200% Series L Cumulative Redeemable Preferred Stock,$21.16,-0.18,-0.843%,,United States,,33763,,
DLTH,Duluth Holdings Inc. Class B Common Stock,$2.85,-0.05,-1.724%,100254889.00,United States,2015,28218,Consumer Discretionary,Clothing/Shoe/Accessory Stores
DLTR,Dollar Tree Inc. Common Stock,$75.62,1.10,1.476%,16261221806.00,United States,1995,2636019,Consumer Discretionary,Department/Specialty Retail Stores
DLX,Deluxe Corporation Common Stock,$17.86,-0.12,-0.667%,790702314.00,United States,,537672,Consumer Discretionary,Publishing
DLY,DoubleLine Yield Opportunities Fund Common Shares of Beneficial Interest,$16.32,-0.06,-0.366%,782475113.00,United States,2020,86740,Finance,Investment Managers
DM,Desktop Metal Inc. Class A Common Stock,$2.63,0.15,6.048%,87687932.00,United States,2019,218613,Technology,Industrial Machinery/Components
DMA,Destra Multi-Alternative Fund Common Stock,$8.76,0.05,0.574%,0.00,,2022,16043,Finance,Trusts Except Educational Religious and Charitable
DMAAU,Drugs Made In America Acquisition Corp. Units,$10.08,0.02,0.199%,0.00,United States,2025,5249,,
DMAC,DiaMedica Therapeutics Inc. Common Stock,$6.65,0.49,7.955%,284357870.00,United States,2018,470769,Health Care,Biotechnology: Pharmaceutical Preparations
DMB,BNY Mellon Municipal Bond Infrastructure Fund Inc. Common Stock,$10.71,0.04,0.375%,0.00,,2013,73646,Finance,Trusts Except Educational Religious and Charitable
DMF,BNY Mellon Municipal Income Inc. Common Stock,$7.17,0.02,0.28%,446625423.00,United States,1988,156946,Finance,Finance/Investors Services
DMLP,Dorchester Minerals L.P. Common Units Representing Limited Partnership Interests,$32.42,0.44,1.376%,1534754890.00,United States,,153639,Energy,Oil & Gas Production
DMN,Damon Inc. Common Stock,$0.4504,-0.0396,-8.082%,9922710.00,United Kingdom,,836514,Technology,EDP Services
DMO,Western Asset Mortgage Opportunity Fund Inc. Common Stock,$12.00,0.03,0.251%,0.00,United States,2010,72875,Finance,Trusts Except Educational Religious and Charitable
DMRC,Digimarc Corporation Common Stock,$29.32,-2.06,-6.565%,628966893.00,United States,,195696,Technology,EDP Services
DMYY,dMY Squared Technology Group Inc. Class A Common Stock,$10.86,0.00,0.00%,0.00,,2022,2,Finance,Blank Checks
DNA,Ginkgo Bioworks Holdings Inc. Class A Common Stock,$12.68,-1.09,-7.916%,728832515.00,United States,2021,2824186,Health Care,Biotechnology: Biological Products (No Diagnostic Substances)
DNB,Dun & Bradstreet Holdings Inc. Common Stock,$10.53,-0.10,-0.941%,4649262883.00,United States,2020,4597803,Finance,Finance: Consumer Services
DNLI,Denali Therapeutics Inc. Common Stock,$22.23,0.44,2.019%,3199377702.00,United States,2017,587405,Health Care,Biotechnology: Biological Products (No Diagnostic Substances)
DNN,Denison Mines Corp Ordinary Shares (Canada),$1.60,-0.03,-1.84%,1427791893.00,Canada,,61642596,Basic Materials,Other Metals and Minerals
DNOW,DNOW Inc. Common Stock,$17.42,-0.17,-0.966%,1843840020.00,United States,2014,931339,Industrials,Metal Fabrications
DNP,DNP Select Income Fund Inc. Common Stock,$9.46,0.05,0.531%,0.00,United States,1987,399177,Finance,Investment Managers
DNTH,Dianthus Therapeutics Inc. Common Stock,$23.34,-0.88,-3.633%,690793163.00,United States,2018,185510,Health Care,Biotechnology: Pharmaceutical Preparations
DNUT,Krispy Kreme Inc. Common Stock,$9.11,0.00,0.00%,1548700000.00,United States,2021,1718432,Consumer Staples,Food Chains
DOC,Healthpeak Properties Inc. Common Stock,$19.50,-0.08,-0.409%,13641510422.00,United States,,4247550,Real Estate,Real Estate Investment Trusts
DOCN,DigitalOcean Holdings Inc. Common Stock,$44.27,-2.42,-5.183%,4085336801.00,United States,2021,1233598,Technology,Computer Software: Programming Data Processing
DOCS,Doximity Inc. Class A Common Stock,$76.68,-1.25,-1.604%,14388013288.00,United States,2021,2343841,Technology,EDP Services
DOCU,DocuSign Inc. Common Stock,$86.73,-0.61,-0.698%,17521467019.00,United States,1989,1734695,Technology,Computer Software: Prepackaged Software
DOGZ,Dogness (International) Corporation Class A Common Stock,$29.27,1.52,5.477%,372626360.00,China,2017,160119,Consumer Discretionary,Miscellaneous manufacturing industries
DOLE,Dole plc Ordinary Shares,$13.52,-0.16,-1.17%,1283442500.00,Ireland,2021,313060,Consumer Staples,Farming/Seeds/Milling
DOMH,Dominari Holdings Inc. Common Stock,$11.62,1.38,13.477%,72928724.00,United States,,1298707,Health Care,Biotechnology: Pharmaceutical Preparations
DOMO,Domo Inc. Class B Common Stock,$8.615,-0.255,-2.875%,336911759.00,United States,2018,315717,Technology,Computer Software: Prepackaged Software
DOOO,BRP Inc. (Recreational Products) Common Subordinate Voting Shares,$43.91,0.22,0.504%,3205875994.00,Canada,,166698,Consumer Discretionary,Industrial Specialties
DORM,Dorman Products Inc. Common Stock,$126.14,-0.85,-0.669%,3849475432.00,United States,,125025,Consumer Discretionary,Auto Parts:O.E.M.
DOUG,Douglas Elliman Inc. Common Stock,$2.14,0.05,2.392%,190817361.00,United States,2021,649717,Finance,Real Estate
DOV,Dover Corporation Common Stock,$204.88,-0.48,-0.234%,28114741796.00,United States,,783469,Industrials,Industrial Machinery/Components
DOW,Dow Inc. Common Stock ,$38.92,-0.80,-2.014%,27393138755.00,United States,2019,6218011,Industrials,Major Chemicals
DOX,Amdocs Limited Ordinary Shares,$89.60,0.05,0.056%,10114994534.00,Guernsey,,651978,Technology,EDP Services
DOYU,DouYu International Holdings Limited ADS,$16.26,0.30,1.88%,514394433.00,China,2019,371694,Technology,Computer Software: Programming Data Processing
DPG,Duff & Phelps Utility and Infrastructure Fund Inc.,$11.92,-0.07,-0.584%,0.00,United States,2011,73780,Finance,Trusts Except Educational Religious and Charitable
DPRO,Draganfly Inc. Common Shares,$3.05,-0.03,-0.974%,12894775.00,Canada,,53798,Industrials,Aerospace
DPZ,Domino's Pizza Inc Common Stock,$475.35,-2.18,-0.457%,16414775742.00,United States,2004,563092,Consumer Discretionary,Food Distributors
DQ,DAQO New Energy Corp. American Depositary Shares each representing five ordinary shares,$22.60,1.17,5.46%,1491768393.00,China,2010,1198913,Technology,Semiconductors
DRCT,Direct Digital Holdings Inc. Class A Common Stock,$1.14,0.00,0.00%,16721407.00,United States,2022,193439,Consumer Discretionary,Advertising
DRD,DRDGOLD Limited American Depositary Shares,$10.55,0.13,1.248%,912141089.00,South Africa,,255956,Basic Materials,Precious Metals
DRDB,Roman DBDR Acquisition Corp. II Ordinary shares,$9.93,0.00,0.00%,0.00,United States,2025,414,,
DRDBU,Roman DBDR Acquisition Corp. II Unit,$10.12,0.00,0.00%,0.00,United States,2024,6218,,
DRDBW,Roman DBDR Acquisition Corp. II Warrants,$0.30,0.00,0.00%,0.00,United States,2025,3000,,
DRH,Diamondrock Hospitality Company Common Stock,$8.65,-0.06,-0.689%,1795672617.00,United States,2005,1584166,Real Estate,Real Estate Investment Trusts
DRH^A,Diamondrock Hospitality Company 8.250% Series A Cumulative Redeemable Preferred Stock,$25.22,-0.0299,-0.118%,,United States,,12794,,
DRI,Darden Restaurants Inc. Common Stock,$196.85,-3.55,-1.771%,23060344824.00,United States,,1551636,Consumer Discretionary,Restaurants
DRIO,DarioHealth Corp. Common Stock,$0.701,-0.02,-2.774%,23901545.00,Israel,,447197,Health Care,Medical/Dental Instruments
DRMA,Dermata Therapeutics Inc. Common Stock,$1.215,-0.0549,-4.323%,2479533.00,United States,2021,170445,Health Care,Biotechnology: Pharmaceutical Preparations
DRMAW,Dermata Therapeutics Inc. Warrant,$0.0299,-0.0001,-0.333%,61019.00,United States,2021,8015,Health Care,Biotechnology: Pharmaceutical Preparations
DRRX,DURECT Corporation Common Stock,$0.8059,0.0369,4.798%,25016732.00,United States,2000,47328,Health Care,Biotechnology: Pharmaceutical Preparations
DRS,Leonardo DRS Inc. Common Stock,$29.54,0.15,0.51%,7810289123.00,Israel,,1234550,Industrials,Industrial Machinery/Components
DRTS,Alpha Tau Medical Ltd. Ordinary Shares,$2.993,-0.087,-2.825%,208524142.00,Israel,,49733,Health Care,Medical/Dental Instruments
DRTSW,Alpha Tau Medical Ltd. Warrant,$0.345,0.0249,7.779%,24036361.00,Israel,,151189,Health Care,Medical/Dental Instruments
DRUG,Bright Minds Biosciences Inc. Common Stock,$37.40,-0.11,-0.293%,261388189.00,Canada,,102437,Health Care,Biotechnology: Pharmaceutical Preparations
DRVN,Driven Brands Holdings Inc. Common Stock,$15.40,-0.14,-0.901%,2527357125.00,United States,2021,854651,Consumer Discretionary,Automotive Aftermarket
DSGN,Design Therapeutics Inc. Common Stock,$4.87,0.74,17.918%,275744450.00,United States,2021,192442,Health Care,Biotechnology: Pharmaceutical Preparations
DSGR,Distribution Solutions Group Inc. Common Stock,$29.86,-0.36,-1.191%,1398579097.00,United States,,36183,Consumer Discretionary,Industrial Specialties
DSGX,Descartes Systems Group Inc. (The) Common Stock,$114.73,-0.14,-0.122%,9813939607.00,Canada,,206662,Technology,Computer Software: Prepackaged Software
DSL,DoubleLine Income Solutions Fund Common Shares of Beneficial Interests,$12.77,-0.11,-0.854%,1302499494.00,United States,2013,492152,Finance,Trusts Except Educational Religious and Charitable
DSM,BNY Mellon Strategic Municipal Bond Fund Inc. Common Stock,$5.99,0.06,1.012%,0.00,United States,1989,271597,Finance,Investment Managers
DSP,Viant Technology Inc. Class A Common Stock,$22.73,-0.58,-2.488%,1428621937.00,United States,2021,329660,Technology,Computer Software: Programming Data Processing
DSS,DSS Inc. Common Stock,$0.9301,0.0001,0.011%,6572805.00,United States,,6038,Consumer Discretionary,Containers/Packaging
DSU,Blackrock Debt Strategies Fund Inc. Common Stock,$10.72,0.01,0.093%,0.00,United States,1998,274764,Finance,Finance Companies
DSWL,Deswell Industries Inc. Common Shares,$2.36,-0.05,-2.075%,37607164.00,Macau,1995,27306,Industrials,Plastic Products
DSX,Diana Shipping inc. common stock,$1.83,-0.08,-4.188%,219532138.00,Greece,2005,557923,Consumer Discretionary,Marine Transportation
DSX^B,Diana Shipping Inc. Perpetual Preferred Shares Series B (Marshall Islands),$26.10,-0.03,-0.115%,,Greece,,835,,
DSY,Big Tree Cloud Holdings Limited Ordinary Shares,$2.04,-0.10,-4.673%,116444314.00,China,,61768,Consumer Discretionary,Containers/Packaging
DSYWW,Big Tree Cloud Holdings Limited Warrants,$0.03,0.00,0.00%,1712416.00,China,,12968,Consumer Discretionary,Containers/Packaging
DT,Dynatrace Inc. Common Stock,$61.64,-0.73,-1.17%,18451936034.00,United States,2019,2331174,Technology,Computer Software: Prepackaged Software
DTB,DTE Energy Company 2020 Series G 4.375% Junior Subordinated Debentures due 2080,$18.62,-0.05,-0.268%,3858853302.00,United States,2020,9280,Utilities,Electric Utilities: Central
DTC,Solo Brands Inc. Class A Common Stock,$0.8881,-0.1019,-10.293%,81413557.00,United States,2021,619010,Consumer Discretionary,Recreational Games/Products/Toys
DTCK,Davis Commodities Limited Ordinary Shares,$0.9356,0.0156,1.696%,22922785.00,Singapore,2023,8091,Industrials,Farming/Seeds/Milling
DTE,DTE Energy Company Common Stock,$130.38,0.83,0.641%,27020262808.00,United States,,1038180,Utilities,Electric Utilities: Central
DTF,DTF Tax-Free Income 2028 Term Fund Inc. Common Stock,$11.35,0.00,0.00%,79785585.00,United States,1991,1327,Finance,Investment Managers
DTG,DTE Energy Company 2021 Series E 4.375% Junior Subordinated Debentures,$18.44,-0.04,-0.216%,3821549672.00,United States,2021,16420,Utilities,Electric Utilities: Central
DTI,Drilling Tools International Corporation Common Stock,$3.14,0.08,2.614%,108972745.00,United States,2021,21618,Industrials,Metal Fabrications
DTIL,Precision BioSciences Inc. Common Stock,$5.65,0.50,9.709%,43341483.00,United States,2019,367649,Health Care,Biotechnology: Biological Products (No Diagnostic Substances)
DTM,DT Midstream Inc. Common Stock ,$101.92,0.41,0.404%,9902154196.00,United States,2021,567921,Utilities,Natural Gas Distribution
DTSQ,DT Cloud Star Acquisition Corporation Ordinary Shares,$10.16,0.01,0.099%,0.00,United States,2024,280403,,
DTSQR,DT Cloud Star Acquisition Corporation Right,$0.15,0.015,11.111%,0.00,United States,2024,25000,,
DTSQU,DT Cloud Star Acquisition Corporation Units,$10.21,0.00,0.00%,0.00,United States,2024,27,,
DTSS,Datasea Inc. Common Stock,$2.3177,0.0177,0.77%,17358187.00,China,,57695,Technology,Computer Software: Prepackaged Software
DTST,Data Storage Corporation Common Stock,$4.0706,0.0706,1.765%,28552707.00,United States,,42021,Technology,EDP Services
DTSTW,Data Storage Corporation Warrant,$0.53,0.029,5.788%,3717618.00,United States,,1047,Technology,EDP Services
DTW,DTE Energy Company 2017 Series E 5.25% Junior Subordinated Debentures due 2077,$22.70,0.0499,0.22%,4704402253.00,United States,2017,10940,Utilities,Electric Utilities: Central
DUK,Duke Energy Corporation (Holding Company) Common Stock,$111.79,0.90,0.812%,86355808055.00,United States,,3860545,Utilities,Power Generation
DUK^A,Duke Energy Corporation Depositary Shares each representing a 1/1000th interest in a share of 5.75% Series A Cumulative Redeemable Perpetual Preferred Stock,$24.93,-0.05,-0.20%,,United States,,62623,,
DUKB,Duke Energy Corporation 5.625% Junior Subordinated Debentures due 2078,$24.70,-0.12,-0.483%,19080315404.00,United States,2018,31578,Utilities,Power Generation
DUO,Fangdd Network Group Ltd. Class A Ordinary Shares,$0.61,0.0069,1.144%,3885700.00,China,2019,1888295,Finance,Real Estate
DUOL,Duolingo Inc. Class A Common Stock,$432.52,-8.87,-2.01%,19024201026.00,United States,2021,821497,Technology,Computer Software: Prepackaged Software
DUOT,Duos Technologies Group Inc. Common Stock,$6.73,-0.58,-7.934%,56603506.00,United States,,105849,Technology,Computer Software: Prepackaged Software
DV,DoubleVerify Holdings Inc. Common Stock,$22.50,-0.57,-2.471%,3806212703.00,United States,2021,1221714,Technology,Computer Software: Programming Data Processing
DVA,DaVita Inc. Common Stock,$154.96,-0.09,-0.058%,12396800000.00,United States,,1235190,Health Care,Misc Health and Biotechnology Services
DVAX,Dynavax Technologies Corporation Common Stock,$13.09,0.16,1.237%,1720740203.00,United States,2004,2890284,Health Care,Biotechnology: Pharmaceutical Preparations
DVLT,Datavault AI Inc. Common Stock,$1.09,-0.06,-5.217%,8466933.00,United States,2018,633628,Technology,Semiconductors
DVN,Devon Energy Corporation Common Stock,$37.57,2.69,7.712%,24679733000.00,United States,1985,21871369,Energy,Oil & Gas Production
DWSN,Dawson Geophysical Company Common Stock,$1.4275,0.0275,1.964%,44228856.00,United States,,2595,Energy,Oil & Gas Production
DWTX,Dogwood Therapeutics Inc. Common Stock,$6.03,0.08,1.345%,8033033.00,United States,2020,193210,Health Care,Biotechnology: Pharmaceutical Preparations
DX,Dynex Capital Inc. Common Stock,$13.81,0.10,0.729%,1095181666.00,United States,,2408316,Real Estate,Real Estate Investment Trusts
DX^C,Dynex Capital Inc. 6.900% Series C Fixed-to-Floating Rate Cumulative Redeemable Preferred Stock,$25.39,-0.05,-0.197%,,United States,,1883,,
DXC,DXC Technology Company Common Stock ,$20.30,-1.02,-4.784%,3675285788.00,United States,,942697,Technology,EDP Services
DXCM,DexCom Inc. Common Stock,$89.68,-0.85,-0.939%,35028594575.00,United States,2005,3251683,Health Care,Medical/Dental Instruments
DXF,Eason Technology Limited American Depositary Shares (each representing sixty-thousand (60000) Ordinary Shares),$13.50,0.00,0.00%,3367764.00,,,133488,Finance,Finance: Consumer Services
DXLG,Destination XL Group Inc. Common Stock,$2.44,-0.08,-3.175%,132509658.00,United States,,109482,Consumer Discretionary,Clothing/Shoe/Accessory Stores
DXPE,DXP Enterprises Inc. Common Stock,$102.91,-0.53,-0.512%,1615160410.00,United States,,136634,Industrials,Industrial Machinery/Components
DXR,Daxor Corporation Common Stock,$7.24,0.01,0.138%,35041600.00,United States,,12125,Health Care,Medical/Dental Instruments
DXST,Decent Holding Inc Ordinary Shares,$1.48,0.04,2.778%,24420000.00,China,2025,61171,Industrials,Miscellaneous
DXYZ,Destiny Tech100 Inc. Common Stock,$54.00,3.45,6.825%,0.00,,2024,898335,,
DY,Dycom Industries Inc. Common Stock,$179.75,5.08,2.908%,5244361734.00,United States,,916718,Industrials,Water Sewer Pipeline Comm & Power Line Construction
DYAI,Dyadic International Inc. Common Stock,$1.41,-0.11,-7.237%,41721013.00,United States,,56953,Health Care,Biotechnology: Biological Products (No Diagnostic Substances)
DYCQ,DT Cloud Acquisition Corporation Ordinary Shares,$10.50,-0.01,-0.095%,0.00,United Kingdom,2024,1782,,
DYN,Dyne Therapeutics Inc. Common Stock,$13.82,0.04,0.29%,1406405540.00,United States,2020,1242265,Health Care,Biotechnology: Pharmaceutical Preparations
DYNX,Dynamix Corporation Class A Ordinary Shares,$9.8614,-0.0086,-0.087%,0.00,United States,2024,707,,
DYNXU,Dynamix Corporation Unit,$10.00,0.00,0.00%,0.00,United States,2024,1670,,
DYNXW,Dynamix Corporation Warrant,$0.32,0.04,14.286%,0.00,United States,2024,31313,,
E,ENI S.p.A. Common Stock,$29.22,-0.22,-0.747%,49322452631.00,Italy,,199794,Energy,Oil & Gas Production
EA,Electronic Arts Inc. Common Stock,$129.34,0.99,0.771%,33708279608.00,United States,,3559140,Technology,Computer Software: Prepackaged Software
EAD,Allspring Income Opportunities Fund Common Shares,$7.03,0.02,0.285%,0.00,United States,2003,167324,Finance,Finance/Investors Services
EAF,GrafTech International Ltd. Common Stock,$1.09,0.01,0.926%,280417444.00,United States,2018,6032179,Energy,Industrial Machinery/Components
EAI,Entergy Arkansas LLC First Mortgage Bonds 4.875% Series Due September 1 2066,$21.37,-0.03,-0.14%,4581899259.00,United States,2016,13045,Utilities,Electric Utilities: Central
EARN,Ellington Credit Company Common Shares of Beneficial Interest,$6.51,0.01,0.154%,187490246.00,United States,2013,684409,Real Estate,Real Estate Investment Trusts
EAT,Brinker International Inc. Common Stock,$161.35,-5.68,-3.401%,7165046377.00,United States,,1189103,Consumer Discretionary,Restaurants
EB,Eventbrite Inc. Class A Common Stock,$3.39,0.01,0.296%,328426180.00,United States,2018,503053,Technology,Computer Software: Programming Data Processing
EBAY,eBay Inc. Common Stock,$69.32,-0.47,-0.673%,33204280000.00,United States,1998,3441174,Consumer Discretionary,Business Services
EBC,Eastern Bankshares Inc. Common Stock,$18.62,-0.17,-0.905%,3997032862.00,United States,2020,1108391,Finance,Savings Institutions
EBF,Ennis Inc. Common Stock,$20.81,0.13,0.629%,541322268.00,United States,,106254,Consumer Discretionary,Office Equipment/Supplies/Services
EBMT,Eagle Bancorp Montana Inc. Common Stock,$17.99,0.38,2.158%,144221944.00,United States,2010,23985,Finance,Major Banks
EBON,Ebang International Holdings Inc. Class A Ordinary Shares,$5.4728,0.0928,1.725%,35813664.00,China,2020,6536,Technology,Semiconductors
EBR,Centrais Electricas Brasileiras S A American Depositary Shares (Each representing one Common Share),$6.63,-0.07,-1.045%,14889748690.00,Brazil,2016,990105,Utilities,Electric Utilities: Central
EBS,Emergent BioSolutions Inc. Common Stock,$7.97,-0.37,-4.436%,431847962.00,United States,2006,2814225,Health Care,Biotechnology: Pharmaceutical Preparations
EBTC,Enterprise Bancorp Inc Common Stock,$43.66,0.09,0.207%,542658435.00,United States,,25071,Finance,Major Banks
EC,Ecopetrol S.A. American Depositary Shares,$10.91,0.08,0.739%,22429156959.00,Colombia,,2803355,Energy,Oil & Gas Production
ECAT,BlackRock ESG Capital Allocation Term Trust Common Shares of Beneficial Interest,$16.79,0.02,0.119%,1815586650.00,United States,2021,301926,Finance,Trusts Except Educational Religious and Charitable
ECBK,ECB Bancorp Inc. Common Stock,$14.31,0.16,1.131%,130471726.00,United States,2022,5628,Finance,Banks
ECC           ,Eagle Point Credit Company Inc. Common Stock,$8.64,0.01,0.116%,524124207.00,United States,2014,692255,Finance,Trusts Except Educational Religious and Charitable
ECC^D,Eagle Point Credit Company Inc. 6.75% Series D Preferred Stock,$19.97,-0.0102,-0.051%,,United States,,16927,,
ECCC,Eagle Point Credit Company Inc. 6.50% Series C Term Preferred Stock due 2031,$23.04,0.0145,0.063%,1397664553.00,United States,,1735,Finance,Trusts Except Educational Religious and Charitable
ECCF,Eagle Point Credit Company Inc. 8.00% Series F Term Preferred Stock due 2029,$25.15,0.03,0.119%,27380121624.00,United States,,8341,,
ECCU,Eagle Point Credit Company Inc. 7.75% Notes due 2030,$25.05,0.01,0.04%,0.00,United States,2024,20231,,
ECCV,Eagle Point Credit Company Inc. 5.375% Notes due 2029,$22.97,-0.02,-0.087%,1393418176.00,United States,2022,3165,Finance,Trusts Except Educational Religious and Charitable
ECCW,Eagle Point Credit Company Inc. 6.75% Notes due 2031,$24.015,-0.155,-0.641%,1456810514.00,United States,2021,1121,Finance,Trusts Except Educational Religious and Charitable
ECCX,Eagle Point Credit Company Inc. 6.6875% Notes due 2028,$24.85,-0.1897,-0.758%,1507463721.00,United States,2022,2163,Finance,Trusts Except Educational Religious and Charitable
ECDA,ECD Automotive Design Inc. Common Stock,$0.85,-0.003,-0.352%,29452213.00,United States,2022,10481,Consumer Discretionary,Auto Manufacturing
ECDAW,ECD Automotive Design Inc. Warrant ,$0.0153,-0.0097,-38.80%,530140.00,United States,2022,4335,Consumer Discretionary,Auto Manufacturing
ECF,Ellsworth Growth and Income Fund Ltd.,$10.02,-0.05,-0.497%,0.00,United States,1986,19406,Finance,Finance/Investors Services
ECF^A,Ellsworth Growth and Income Fund Ltd. 5.25% Series A Cumulative Preferred Shares (Liquidation Preference $25.00 per share),$21.945,-0.355,-1.592%,,United States,,536,,
